continent,name,botanicalName,commonNames,habitat,medicinalUses,medicinalRecipe,methodsOfCultivation,videos,modelBasePath
Asia,Amla,Emblica officinalis,"Amla, Indian gooseberry, Amalaki","Subtropical regions of India, Nepal, Sri Lanka, and throughout South and Southeast Asia. Amla trees are often found in deciduous forests and are cultivated in orchards.","Antioxidant powerhouse: Amla is one of the richest natural sources of vitamin C, containing 20 times more vitamin C than orange juice. This high antioxidant content helps protect cells from damage caused by free radicals, potentially reducing the risk of chronic diseases and slowing the aging process.
Digestive health: Amla is known to improve digestion by stimulating the secretion of digestive enzymes. It can help relieve constipation, reduce acid reflux, and promote a healthy gut microbiome. The high fiber content aids in regular bowel movements and can help manage conditions like irritable bowel syndrome (IBS).
Immune system booster: The abundance of vitamin C and other nutrients in amla significantly enhances the immune system, making it more effective at fighting infections and reducing the severity and duration of common illnesses like colds and flu.
Hair and skin health: Amla is a staple in Ayurvedic hair and skincare remedies. It's believed to promote hair growth, prevent premature graying, and strengthen hair follicles. For skin, amla's antioxidant properties can help reduce signs of aging, improve skin elasticity, and promote a healthy, glowing complexion.
Blood sugar regulation: Studies suggest that amla may help lower blood sugar levels and improve insulin sensitivity, making it potentially beneficial for people with or at risk of type 2 diabetes.
Cardiovascular health: Amla may help reduce cholesterol levels, lower blood pressure, and improve overall heart health due to its antioxidant and anti-inflammatory properties.
Liver protection: The fruit has hepatoprotective properties, which means it can help protect the liver from damage and may aid in its normal functioning.","Amla juice: Wash and chop 2-3 fresh amla fruits. Blend them with 1 cup of water until smooth. Strain the mixture through a fine sieve. Add a pinch of salt and a teaspoon of honey if desired. Drink this juice first thing in the morning on an empty stomach for best results.
Amla powder supplement: Dry amla fruits in the sun or a dehydrator until completely moisture-free. Grind the dried fruits into a fine powder using a spice grinder. Store in an airtight container. Consume 1 teaspoon of amla powder daily, mixed with warm water or honey.
Amla hair mask: Mix 2 tablespoons of amla powder with enough water to form a paste. Add 1 tablespoon of coconut oil and mix well. Apply this paste to your scalp and hair, leave for 30 minutes, then rinse thoroughly. Use weekly for healthier, shinier hair.
Amla chutney: Chop 1 cup of fresh amla fruits finely. In a pan, heat 1 tablespoon of oil and add 1 teaspoon of mustard seeds. When they splutter, add the chopped amla, 2-3 green chilies, and a pinch of salt. Cook until the amla softens. Cool and blend to a smooth paste. This tangy chutney can be eaten with meals to aid digestion.","Amla trees can be grown from seeds or grafted saplings. While they can be challenging to grow outside their native range, with proper care, they can thrive in suitable climates.
Soil: Amla trees prefer well-draining, fertile soil with a pH between 6.5 and 7.5. They can tolerate a range of soil types but do best in loamy soil enriched with organic matter.
Climate: Amla trees are suited to tropical and subtropical climates. They can tolerate temperatures between 32°F to 120°F (0°C to 49°C) but prefer warm temperatures between 70°F to 95°F (21°C to 35°C).
Water: Young trees need regular watering, especially during dry periods. Mature trees are somewhat drought-tolerant but benefit from deep watering during prolonged dry spells.
Sunlight: Amla trees require full sun to partial shade. In very hot climates, some afternoon shade can be beneficial.
Fertilizer: Apply a balanced, organic fertilizer in early spring before new growth begins. Mulching around the base of the tree can help retain moisture and provide nutrients as the mulch breaks down.
Pruning: Prune young trees to establish a strong branch structure. Mature trees require minimal pruning, mainly to remove dead or crossing branches.
Harvesting: Amla fruits are typically ready for harvest in late autumn to early winter, depending on the variety and climate. Hand-pick the fruits when they are firm and light green in color.",https://youtu.be/HPLJyKCJWUg?si=wpdIkzXNLp0PtR2F,Amla
Asia,Neem,Azadirachta indica,"Neem, Indian lilac, Nimtree","Native to the Indian subcontinent, now widely distributed in tropical and subtropical regions worldwide. Neem trees are adaptable and can grow in various soil types and climatic conditions.","Antibacterial and antifungal: Neem has potent antimicrobial properties, effective against a wide range of bacteria, fungi, and even some viruses. It's used to treat various skin infections, fungal diseases, and can help with conditions like acne, eczema, and psoriasis.
Oral health: Neem twigs have been traditionally used as natural toothbrushes in many parts of India. Neem extract is often added to toothpaste and mouthwash for its antibacterial properties, helping to prevent gum disease, reduce plaque, and freshen breath.
Insect repellent: Neem oil is a powerful natural insecticide and can be used to repel mosquitoes, flies, and other insects. It's also used in organic farming to protect crops from pests.
Blood purifier: In Ayurvedic medicine, neem is considered a potent blood purifier. It's believed to detoxify the blood and liver, potentially helping with skin disorders and supporting overall health.
Anti-inflammatory: Neem has natural anti-inflammatory properties, which can help reduce swelling and pain associated with arthritis and other inflammatory conditions.
Immune system support: Regular consumption of neem in small amounts is believed to boost the immune system, helping the body fight off various infections and diseases.
Hair care: Neem oil and extracts are often used in hair care products to treat dandruff, prevent hair loss, and promote healthy hair growth.
Contraceptive: Some studies suggest that neem may have contraceptive properties, though more research is needed in this area.","Neem face pack: Mix 2 tablespoons of neem powder with enough rose water to form a paste. Add 1 teaspoon of honey if desired. Apply this paste to your face, avoiding the eye area. Leave for 15-20 minutes, then rinse off with cool water. Use weekly for clear, blemish-free skin.
Neem tea: Steep 10-15 fresh neem leaves (or 1 teaspoon of dried neem leaves) in a cup of hot water for 5-10 minutes. Strain and drink this tea once daily. The taste is quite bitter, so you may want to add honey or lemon for flavor.
Neem oil for skin and hair: Mix a few drops of neem oil with a carrier oil like coconut or jojoba oil. Apply this mixture to affected areas of skin or massage into the scalp. Leave for 30 minutes to an hour before washing off.
Neem mouthwash: Add 10 drops of neem oil to a cup of warm water. Swish this solution in your mouth for 30 seconds to 1 minute, then spit out. Use daily for improved oral health.
Neem-infused oil for joint pain: Warm 1 cup of coconut oil and add 1/4 cup of dried neem leaves. Heat gently for 10 minutes, then strain. Once cooled, massage this oil into sore joints for relief from arthritis pain.","Neem trees are hardy and relatively easy to grow, adapting well to various conditions. They can be grown from seeds, stem cuttings, or root suckers.
Soil: Neem trees can grow in a wide range of soil types but prefer well-draining, sandy loam or clay loam soils. They can tolerate poor, rocky soils and even slightly alkaline conditions.
Climate: Neem trees thrive in tropical and subtropical climates. They prefer hot temperatures but can tolerate temperatures as low as 35°F (2°C) for short periods. They are drought-tolerant once established.
Water: Young neem trees require regular watering for the first 2-3 years. Once established, they are quite drought-resistant but benefit from occasional deep watering, especially during prolonged dry spells.
Sunlight: Neem trees prefer full sun but can tolerate partial shade. They grow best with at least 6 hours of direct sunlight daily.
Fertilizer: Neem trees don't require much fertilizer, especially if planted in fertile soil. A light application of balanced, organic fertilizer in spring can promote healthy growth.
Pruning: Regular pruning helps maintain the desired shape and size of the tree. Prune in late winter or early spring before new growth begins.
Space: When planting, consider that neem trees can grow quite large, reaching heights of 50-65 feet (15-20 meters) with a spread of 50-65 feet. Ensure they have enough space to reach their full size.
Harvesting: Leaves can be harvested year-round as needed. Neem fruits are typically ready for harvest in late spring to early summer, depending on the region.",https://youtu.be/ZCq0ZVRWCPQ?si=5EiXQfDNui1QJMWp,Amla
Asia,Ashwagandha,Withania somnifera,"Ashwagandha, Indian ginseng, Winter cherry","Native to the dry regions of India, North Africa, and the Middle East. It's now cultivated in mild climates around the world, thriving in arid to semi-arid conditions.","Stress relief: Ashwagandha is a powerful adaptogen that helps the body manage stress and anxiety. It can lower cortisol levels, promoting a sense of calm and well-being. Regular use may help improve resilience to both physical and mental stress.
Immune booster: It enhances the body's defense against diseases by improving cell-mediated immunity. Regular consumption may help reduce the frequency and severity of infections, and support overall immune function.
Anti-inflammatory: Ashwagandha has been shown to decrease inflammation in the body, which may help in managing conditions like arthritis, asthma, and hypertension. This anti-inflammatory action may also contribute to its potential anti-aging effects.
Cognitive function: Studies suggest that ashwagandha may improve memory, reaction time, and task performance. It's being investigated for its potential in treating neurodegenerative diseases like Alzheimer's and Parkinson's. The herb may also help reduce brain cell degeneration.
Endurance and strength: Ashwagandha has been shown to increase muscle mass and strength. It may also improve cardiorespiratory endurance, making it popular among athletes and fitness enthusiasts.
Hormonal balance: The herb may help regulate thyroid hormones and has been shown to improve reproductive health in both men and women. It may increase testosterone levels in men and alleviate symptoms of menopause in women.
Blood sugar regulation: Some studies indicate that ashwagandha may help lower blood sugar levels, potentially benefiting people with diabetes or those at risk of the condition.
Sleep aid: Ashwagandha may help improve sleep quality and reduce insomnia. Its stress-reducing properties can contribute to better overall sleep patterns.
Mood enhancement: Regular consumption of ashwagandha has been linked to reduced symptoms of depression and improved overall mood.","Ashwagandha powder with warm milk: Mix 1/2 to 1 teaspoon of ashwagandha powder into a cup of warm milk. Add honey to taste if desired. Drink this mixture before bedtime for better sleep and stress relief.
Ashwagandha tea: Simmer 1 teaspoon of ashwagandha root powder in 1 cup of water for 10 minutes. Strain, add honey and a splash of lemon juice if desired. Drink once or twice daily.
Ashwagandha smoothie: Blend 1 banana, 1 cup of almond milk, 1 tablespoon of almond butter, 1 teaspoon of ashwagandha powder, and a dash of cinnamon. This makes a nutritious breakfast or post-workout drink.
Ashwagandha ghee: Melt 1/4 cup of ghee (clarified butter) over low heat. Add 1 tablespoon of ashwagandha powder and simmer for 5 minutes. Strain and store in a glass jar. Use 1 teaspoon daily as a spread or in cooking.
Stress-relief tincture: Combine equal parts ashwagandha root powder and vodka in a jar. Shake daily for 4-6 weeks, then strain. Take 1/4 to 1/2 teaspoon of the tincture in water as needed for stress relief.","Ashwagandha is a relatively easy plant to grow, especially in regions with a climate similar to its native habitat. Here are detailed cultivation methods:
Soil: Ashwagandha prefers well-draining, sandy loam to clay loam soils with a pH between 7.5 and 8.0. The plant can tolerate poor soil conditions but thrives in fertile soil rich in organic matter.
Climate: It grows best in dry, subtropical regions. Ashwagandha can tolerate temperatures between 70°F to 95°F (21°C to 35°C). It's drought-resistant but cannot withstand frost or excessive rainfall.
Planting: Sow seeds directly in the field or in small pots for transplanting. Plant seeds 1/4 inch deep and keep the soil moist until germination, which usually occurs within two weeks.
Spacing: When planting in the ground, space plants about 2 feet (60 cm) apart in rows 3 feet (90 cm) apart to allow for proper growth and easy harvesting.
Watering: Water moderately. While established plants are drought-tolerant, regular watering during dry spells will promote better growth. Avoid overwatering as it can lead to root rot.
Sunlight: Ashwagandha requires full sun to partial shade. Ensure it receives at least 6 hours of direct sunlight daily for optimal growth.
Fertilizer: The plant doesn't require heavy fertilization. A light application of balanced, organic fertilizer at the beginning of the growing season is usually sufficient.
Pest and disease control: Ashwagandha is relatively resistant to pests and diseases. However, it can be susceptible to fungal diseases in overly moist conditions. Ensure good air circulation and avoid overhead watering to prevent these issues.
Harvesting: Roots are typically harvested 150-180 days after planting. The best time to harvest is when the fruits turn red and begin to dry. Carefully dig up the entire plant and collect the roots.
Post-harvest: Clean the roots thoroughly and dry them in the shade. Once completely dry, store in airtight containers in a cool, dry place.",https://youtu.be/W_539qjTc1A?si=LMDZXOG_5XEZmq6O,Ashwagandha
Asia,Moringa,Moringa oleifera,"Moringa, Drumstick tree, Horseradish tree","Native to parts of Africa and Asia, particularly in the foothills of the Himalayas in northwestern India. Now widely cultivated in tropical and subtropical areas worldwide.","Nutritional powerhouse: Moringa leaves are exceptionally nutritious, containing high levels of vitamins A, C, and E, calcium, potassium, and protein. It's often used to combat malnutrition in developing countries.
Antioxidant properties: Rich in antioxidants, moringa helps protect cells from damage, potentially reducing the risk of various chronic diseases.
Anti-inflammatory: The isothiocyanates, flavonoids, and phenolic acids in moringa have strong anti-inflammatory properties.
Blood sugar regulation: Some studies suggest that moringa may help lower blood sugar levels, which could be beneficial for people with diabetes.
Cholesterol reduction: Moringa may help reduce cholesterol levels, potentially lowering the risk of heart disease.
Liver protection: The high concentration of polyphenols in moringa leaves may help protect the liver against oxidation and toxicity.
Skin and hair health: The vitamin A and E content makes moringa beneficial for skin and hair health when applied topically or consumed.","Moringa tea: Steep 1 teaspoon of dried moringa leaves in hot water for 5-10 minutes. Strain and enjoy. Can be consumed 1-2 times daily.
Moringa smoothie: Blend 1 banana, 1 cup of spinach, 1 tablespoon of moringa powder, and 1 cup of almond milk. Add honey to taste if desired.
Moringa face mask: Mix 1 tablespoon of moringa powder with enough water to form a paste. Apply to face, leave for 15 minutes, then rinse off.
Moringa soup: Add 1-2 tablespoons of moringa powder to your favorite vegetable soup recipe for a nutritional boost.","Soil: Moringa prefers well-draining, neutral to slightly acidic soil (pH 6.3 to 7.0). It can tolerate poor soils but thrives in fertile, loamy soil.
Climate: Moringa grows best in tropical and subtropical climates. It prefers hot, dry conditions and is drought-tolerant once established.
Planting: Can be grown from seeds or cuttings. Plant seeds 1/2 inch deep or plant 1-meter long cuttings directly into the soil.
Watering: Water regularly when young, but reduce watering once established. Moringa is drought-tolerant but benefits from occasional deep watering.
Sunlight: Requires full sun, at least 6 hours of direct sunlight daily.
Fertilizer: Moringa doesn't require much fertilizer. A light application of compost or balanced organic fertilizer in spring is usually sufficient.
Pruning: Regular pruning is important to promote bushier growth and easier harvesting. Prune the main trunk to encourage branching.
Harvesting: Leaves can be harvested 6-8 weeks after planting. Regular harvesting promotes continued leaf production.",https://youtu.be/864ZbDaOKfc?si=Dd1szO6ufcX8dOrH,Amla
Asia,Turmeric,Curcuma longa,"Turmeric, Indian saffron","Native to the Indian subcontinent and Southeast Asia. Thrives in warm, humid climates with plenty of annual rainfall.","Anti-inflammatory: Curcumin, the active compound in turmeric, is a potent anti-inflammatory agent, potentially helpful in managing conditions like arthritis.
Antioxidant: Turmeric is rich in antioxidants that can protect cells from damage caused by free radicals.
Brain function: Some studies suggest that curcumin may help improve memory and reduce the risk of brain diseases.
Heart health: Turmeric may help improve the function of the endothelium (the lining of blood vessels), potentially reducing the risk of heart disease.
Cancer prevention: While more research is needed, some studies suggest that turmeric may have cancer-fighting properties.
Digestive health: Turmeric can help stimulate bile production, potentially aiding digestion.
Skin health: When applied topically, turmeric may help with various skin conditions due to its anti-inflammatory and antibacterial properties.","Golden milk: Heat 1 cup of milk with 1 teaspoon of turmeric powder, a pinch of black pepper, and honey to taste. Drink before bedtime for better sleep and reduced inflammation.
Turmeric tea: Steep 1 teaspoon of turmeric powder in hot water for 10 minutes. Add lemon and honey to taste.
Anti-inflammatory paste: Mix equal parts turmeric powder and raw honey. Apply to affected areas for relief from minor cuts, burns, or skin irritations.
Turmeric smoothie: Blend 1 banana, 1 cup of mango, 1 teaspoon of turmeric powder, a pinch of black pepper, and 1 cup of coconut milk.","Soil: Turmeric prefers well-draining, fertile, and slightly acidic soil (pH 6.0 to 6.5). Rich, loamy soils are ideal.
Climate: Turmeric thrives in warm and humid conditions. It requires temperatures between 68°F to 86°F (20°C to 30°C) and annual rainfall of 60-150 inches.
Planting: Plant rhizome pieces with 2-3 buds, about 2 inches deep and 12-16 inches apart.
Watering: Keep the soil consistently moist but not waterlogged. Turmeric requires regular watering, especially during dry spells.
Sunlight: Turmeric grows best in partial shade, although it can tolerate full sun in cooler climates.
Fertilizer: Apply a balanced, organic fertilizer monthly during the growing season. Turmeric benefits from nutrient-rich soil.
Mulching: Apply a thick layer of organic mulch to retain moisture and suppress weeds.
Harvesting: Turmeric is typically ready for harvest 8-10 months after planting when the leaves and stem start to turn yellow and dry.",https://youtu.be/Zqp6NTJKSLA?si=2wInOyVuxz4_5J6p,Amla
Asia,Giloy,Tinospora cordifolia,"Giloy, Guduchi, Heart-leaved moonseed","Native to India, Myanmar, and Sri Lanka. Grows in tropical and subtropical regions, often found in deciduous and dry forests.","Immune booster: Giloy is known for its immunomodulatory properties, helping to strengthen the immune system.
Anti-inflammatory: It may help reduce inflammation in the body, potentially beneficial for conditions like arthritis.
Fever reducer: Traditionally used to treat various types of fevers, including dengue and malaria.
Digestive aid: Giloy can help improve digestion and alleviate gastrointestinal issues.
Blood sugar regulation: Some studies suggest it may help in managing blood sugar levels in diabetics.
Liver protection: Giloy has hepatoprotective properties, potentially beneficial for liver health.
Stress relief: It's considered an adaptogen, helping the body cope with stress.","Giloy juice: Blend fresh giloy stems with water, strain, and drink on an empty stomach for general health.
Giloy tea: Boil dried giloy powder in water for 10 minutes, strain, and add honey to taste.
Giloy and turmeric shot: Mix 1 tsp giloy powder, 1/2 tsp turmeric powder, and a pinch of black pepper in warm water. Drink daily for immune support.
Giloy and amla juice: Blend fresh giloy stems and amla fruit, strain, and dilute with water. Drink for antioxidant benefits.","Soil: Giloy prefers well-draining, fertile soil. It can grow in a variety of soil types but thrives in loamy soil.
Climate: It grows best in tropical and subtropical climates, tolerating temperatures between 59°F to 104°F (15°C to 40°C).
Planting: Propagate using stem cuttings or seeds. Plant cuttings directly in soil or start seeds in pots.
Watering: Water regularly to keep the soil moist, especially during dry periods. Avoid waterlogging.
Sunlight: Giloy prefers partial shade to full sun. In hotter regions, some afternoon shade is beneficial.
Support: As a climbing plant, giloy needs support to grow. Provide a trellis or allow it to climb on trees.
Harvesting: Stems can be harvested once the plant is well-established, typically after 2-3 years of growth.",https://youtu.be/ieAhlLsw5fQ?si=xGm9idptlq238RWC,Giloy
Asia,Thai Basil,Ocimum basilicum var. thyrsiflora,"Thai basil, Sweet Thai basil, Horapa","Native to Southeast Asia, particularly Thailand, Vietnam, Cambodia, and Laos. Thrives in warm, tropical climates.","Digestive aid: Thai basil can help alleviate digestive issues and reduce bloating.
Stress relief: The aroma of Thai basil has calming properties, potentially reducing stress and anxiety.
Anti-inflammatory: Contains compounds that may help reduce inflammation in the body.
Antioxidant: Rich in antioxidants, which can help protect cells from damage caused by free radicals.
Antibacterial: Thai basil has natural antibacterial properties, potentially helpful in fighting certain infections.
Circulation: May help improve blood circulation when consumed regularly.
Respiratory health: The essential oils in Thai basil can help clear congestion and support respiratory health.","Thai basil tea: Steep fresh Thai basil leaves in hot water for 5-10 minutes. Add honey if desired.
Thai basil and lemon drink: Muddle Thai basil leaves, mix with fresh lemon juice and water. Sweeten with honey if needed.
Thai basil oil: Infuse Thai basil leaves in carrier oil (like coconut oil) for several weeks. Use for massage or aromatherapy.
Thai basil compress: Wrap steamed Thai basil leaves in a cloth and apply to sore muscles or joints for relief.","Soil: Thai basil prefers well-draining, fertile soil with a pH between 6.0 and 7.0.
Climate: Thrives in warm climates with temperatures between 65°F to 85°F (18°C to 29°C).
Planting: Sow seeds directly in the garden after the last frost, or start indoors 6-8 weeks before the last frost date.
Watering: Keep soil consistently moist but not waterlogged. Water deeply once or twice a week.
Sunlight: Thai basil prefers full sun, requiring at least 6-8 hours of direct sunlight daily.
Fertilizer: Feed with a balanced, water-soluble fertilizer every 4-6 weeks during the growing season.
Pruning: Regularly pinch off flower buds and top leaves to encourage bushier growth and prevent bolting.
Harvesting: Begin harvesting leaves when the plant reaches 6-8 inches tall. Harvest regularly to promote growth.",https://youtu.be/npM5AXEsjTU?si=bp7dtnejzl0OrUJj,Thai Basil
