continent,name,botanicalName,commonNames,habitat,medicinalUses,medicinalRecipe,methodsOfCultivation,videos,modelBasePath
Africa,African Wormwood,Artemisia afra,"Wild wormwood, African sage",Mountainous regions of southern and eastern Africa.,"Respiratory health: African wormwood is commonly used to treat coughs, colds, bronchitis, and asthma.
Digestive aid: It helps alleviate indigestion, bloating, and stomach cramps.
Anti-parasitic: Traditionally used to treat intestinal worms and other parasitic infections.
Pain relief: Known for its analgesic properties, it is used to relieve headaches and muscle pain.
Fever reducer: Used as a natural remedy to reduce fever and flu symptoms.","Wormwood tea: Steep 1-2 teaspoons of dried African wormwood leaves in boiling water for 10 minutes. Drink 1 cup daily to relieve respiratory issues.
Wormwood poultice: Crush fresh leaves and apply directly to the skin to relieve muscle pain or insect bites.","Soil: Prefers well-draining, loamy soil with a slightly acidic to neutral pH.
Light: Thrives in full sun but can tolerate partial shade.
Water: Requires moderate watering, allowing the soil to dry between waterings.
Temperature: Tolerates a range of temperatures but prefers warm, temperate climates.
Propagation: Propagated through seeds or cuttings.
Fertilizer: Fertilize with organic compost or a balanced fertilizer during the growing season.",https://youtu.be/dPfjLQ1ScM4,African Wormwood
Africa,Honeybush,Cyclopia intermedia,"Bergtee, Heuningbos",Coastal and mountainous regions of South Africa.,"Digestive health: Honeybush tea is used to improve digestion and relieve stomach cramps.
Anti-inflammatory: The plant has anti-inflammatory properties, helping reduce inflammation in the body.
Antioxidant: Honeybush is rich in antioxidants, which protect the body against oxidative stress and cell damage.
Respiratory health: Traditionally used to relieve symptoms of colds, coughs, and asthma.
Skin care: The tea can be applied topically to soothe skin irritations and improve skin health.","Honeybush tea: Steep 1 tablespoon of dried honeybush leaves in boiling water for 5-7 minutes. Drink 2-3 cups daily for digestive health and respiratory support.
Honeybush face rinse: Brew honeybush tea and allow it to cool. Use the tea as a gentle face rinse to soothe and refresh the skin.","Soil: Prefers acidic, well-draining soil rich in organic matter.
Light: Requires full sun exposure for optimal growth.
Water: Water regularly, especially during dry periods, but avoid waterlogging.
Temperature: Thrives in mild coastal climates but can tolerate brief periods of frost.
Propagation: Grown from seeds or cuttings, with seed germination benefiting from smoke treatment.
Fertilizer: Use a slow-release organic fertilizer in spring to encourage healthy growth.",https://youtu.be/YmtzFjjsPoM,Honeybush
Africa,Pelargonium,Pelargonium sidoides,"African geranium, Umckaloabo",Rocky grasslands and hillsides of South Africa.,"Respiratory health: Pelargonium is commonly used to treat upper respiratory infections, such as bronchitis, sinusitis, and the common cold.
Immune support: It boosts the immune system, helping to fight off infections.
Antiviral: Known for its antiviral properties, it helps combat viruses responsible for respiratory ailments.
Anti-inflammatory: The plant reduces inflammation in the airways and lungs, making it useful for treating asthma and bronchitis.","Pelargonium syrup: Boil 1 tablespoon of dried Pelargonium root in 2 cups of water until reduced by half. Strain and add honey to taste. Take 1 tablespoon of this syrup up to 3 times daily for respiratory infections.
Pelargonium tea: Steep 1 teaspoon of dried root in boiling water for 10 minutes. Drink twice daily to boost immune function and relieve colds.","Soil: Prefers well-draining, slightly sandy soil with organic matter.
Light: Needs full sunlight for vigorous growth.
Water: Water moderately, allowing the soil to dry out between waterings.
Temperature: Grows well in temperate climates but should be protected from extreme frost.
Propagation: Can be propagated from seeds or cuttings, with cuttings being the easiest method.
Fertilizer: Apply a balanced fertilizer during the growing season for healthy growth.",https://youtu.be/7Qrh-ZzwjLg,Pelargonium
Africa,Gum Arabic,Acacia senegal,"Gum acacia, Senegal gum","Dry, arid regions of sub-Saharan Africa, particularly in Sudan, Chad, and Nigeria.","Digestive health: Gum Arabic is used as a dietary fiber to promote gut health and improve digestion.
Wound healing: It is applied to wounds to speed up healing and reduce inflammation.
Cough suppressant: Traditionally used to soothe sore throats and suppress coughing.
Blood sugar control: Gum Arabic helps regulate blood sugar levels, making it beneficial for people with diabetes.
Cholesterol reduction: It helps lower cholesterol levels by binding to bile acids in the intestine.","Gum Arabic drink: Dissolve 1-2 teaspoons of powdered Gum Arabic in a glass of warm water. Drink daily to improve digestive health and reduce cholesterol.
Gum Arabic throat lozenges: Mix powdered Gum Arabic with honey and form into small lozenges. Take 1-2 lozenges to soothe a sore throat and suppress coughing.","Soil: Thrives in well-draining, sandy, or loamy soil.
Light: Requires full sunlight for optimal growth.
Water: Drought-tolerant but requires regular watering during its initial growth phase.
Temperature: Prefers hot, arid climates and is highly resistant to heat and dry conditions.
Propagation: Propagated by seeds, which are soaked in hot water before planting.
Fertilizer: Minimal fertilizer is needed, but a light application of organic compost can be used.",https://youtu.be/LkWyXOdMQfM,Gum Arabic
Africa,Bitter Aloe,Aloe ferox,"Cape Aloe, Red Aloe","Dry, rocky hills and grasslands in southern Africa, especially in South Africa.","Skin care: The gel from the leaves is used to treat burns, wounds, and skin irritations, similar to Aloe vera.
Digestive aid: The bitter latex from the leaves has been traditionally used as a powerful laxative.
Anti-inflammatory: Bitter Aloe contains compounds that reduce inflammation and pain, especially in conditions like arthritis.
Immune support: Its high antioxidant content helps boost the immune system and protect the body from infections.
Detoxification: The latex is sometimes used in detox regimens to cleanse the digestive system.","Aloe ferox laxative: Scrape the yellow latex from the outer leaf and allow it to dry. Use a small amount (less than a gram) in herbal teas to relieve constipation, but use cautiously as it is very potent.
Aloe gel for skin: Cut a fresh leaf, remove the outer skin, and apply the gel directly to burns or irritated skin to soothe and promote healing.","Soil: Prefers well-draining, sandy soil.
Light: Requires full sun to partial shade.
Water: Water sparingly and allow the soil to dry out between waterings.
Temperature: Tolerates warm to hot climates, but should be protected from frost.
Propagation: Propagates easily from cuttings or offsets. Allow cuttings to dry before planting to prevent rot.
Fertilizer: Apply a light dose of balanced fertilizer during the growing season, but Aloe ferox generally requires minimal fertilization.",https://youtu.be/TXjZj9ycHSo,Bitter Aloe
Africa,Centella,Centella asiatica,"Gotu Kola, Indian Pennywort","Wetlands and marshy areas of tropical Africa, Asia, and Madagascar.","Cognitive function: Often used to enhance mental clarity, memory, and cognitive function.
Wound healing: Promotes collagen production and accelerates wound healing and tissue repair.
Anti-anxiety: Known for its calming effects, helping to reduce anxiety and stress.
Circulatory health: Improves blood circulation and strengthens veins, beneficial for varicose veins and chronic venous insufficiency.
Skin health: Used to treat skin conditions like eczema and psoriasis due to its anti-inflammatory and healing properties.","Gotu Kola tea: Steep 1-2 teaspoons of dried Centella leaves in hot water for 10 minutes. Drink 1-2 cups daily for cognitive and skin health.
Wound ointment: Crush fresh Centella leaves and mix with coconut oil. Apply to wounds or skin conditions for accelerated healing.","Soil: Prefers rich, moist, well-draining soil, often grown in wetland conditions.
Light: Thrives in partial to full shade.
Water: Requires consistently moist soil; ideal for aquatic or semi-aquatic environments.
Temperature: Grows well in tropical and subtropical climates; not frost-tolerant.
Propagation: Propagates easily from seeds or cuttings.
Fertilizer: Apply a balanced fertilizer to promote lush growth, particularly in nutrient-poor soils.",https://youtu.be/l2C2i7wWbhA,Centella
Africa,Madagascan Periwinkle,Catharanthus roseus,"Vinca, Rosy Periwinkle",Tropical and subtropical regions of Madagascar and other parts of Africa.,"Cancer treatment: Contains vincristine and vinblastine, compounds used in chemotherapy for treating leukemia and lymphoma.
Diabetes management: Traditionally used to manage blood sugar levels and diabetes-related symptoms.
Antimicrobial: Exhibits antimicrobial properties, useful for treating infections.
Anti-inflammatory: Reduces inflammation, beneficial for conditions like arthritis.
Hypertension: Helps lower blood pressure and improve cardiovascular health.","Periwinkle tea: Steep 1 teaspoon of dried Catharanthus leaves in boiling water for 10 minutes. Drink up to twice daily for its medicinal properties.
Herbal tincture: Soak dried leaves in alcohol for 2-3 weeks, then strain. Use 10-15 drops of the tincture daily for blood sugar control.","Soil: Prefers well-draining, sandy loam or loamy soil.
Light: Requires full sun for optimal growth.
Water: Water regularly but avoid waterlogging; allows soil to dry between waterings.
Temperature: Thrives in warm climates and is not frost-tolerant.
Propagation: Grows from seeds or stem cuttings.
Fertilizer: Fertilize with a balanced, all-purpose fertilizer during the growing season.",https://youtu.be/Y4aSZRKa-YM,Madagascan Periwinkle
Africa,Bitter Melon,Momordica charantia,"Bitter gourd, Balsam pear",Tropical and subtropical regions of Africa and Asia.,"Diabetes management: Known for its blood sugar-lowering properties, used to treat diabetes.
Digestive health: Improves digestion and helps relieve constipation.
Immune system boost: Contains antioxidants that support immune function.
Liver health: Helps detoxify the liver and improve its function.
Weight loss: Bitter Melon helps in fat metabolism and weight loss.","Bitter Melon juice: Juice the fruit and drink 1/4 cup daily to manage blood sugar levels.
Stir-fry: Bitter Melon can be cooked in stir-fries or soups with spices to balance its bitterness.","Soil: Prefers well-draining, fertile soil rich in organic matter.
Light: Requires full sunlight.
Water: Water regularly, ensuring the soil stays moist but not waterlogged.
Temperature: Thrives in warm temperatures and is frost-sensitive.
Propagation: Grown from seeds; soak seeds before planting for better germination.
Fertilizer: Apply organic compost or balanced fertilizer during the growing season.",https://youtu.be/8qAIE_P37_U,Bitter Melon
Africa,Umckaloabo,Pelargonium sidoides,South African Geranium,Mountainous regions of southern Africa.,"Respiratory infections: Used to treat bronchitis, colds, and respiratory infections.
Immune support: Enhances the immune system's ability to fight infections.
Antimicrobial: Exhibits antimicrobial properties, effective against various pathogens.
Anti-inflammatory: Reduces inflammation and relieves symptoms of sore throat and cough.
Digestive health: Used traditionally to treat diarrhea and digestive issues.","Umckaloabo tincture: Extract from the root is taken as a tincture to treat respiratory infections. Take 20-30 drops daily during illness.
Herbal tea: Steep 1-2 teaspoons of dried root in boiling water for 10 minutes. Drink 2-3 times daily for immune support.","Soil: Prefers well-draining, sandy soil.
Light: Grows best in full sun to partial shade.
Water: Water regularly but avoid waterlogging.
Temperature: Thrives in warm, temperate climates.
Propagation: Grown from seeds or cuttings.
Fertilizer: Apply a balanced fertilizer during the growing season.",https://youtu.be/7Qrh-ZzwjLg,Umckaloabo
Africa,Acalypha indica,Acalypha indica,"Indian Acalypha, Copperleaf","Tropical and subtropical regions of Africa, including coastal areas and lowlands.","Anti-inflammatory: Used to reduce inflammation and treat conditions like arthritis.
Digestive health: Helps in treating gastrointestinal disorders and improves digestion.
Antimicrobial: Exhibits antimicrobial properties useful in treating infections.
Skin care: Used in traditional medicine to treat skin infections and wounds.
Respiratory health: Helps in treating coughs and respiratory infections.","Acalypha leaf tea: Steep 1-2 teaspoons of dried leaves in boiling water for 10 minutes. Drink up to twice daily for digestive and anti-inflammatory benefits.
Poultice: Crush fresh leaves and apply the paste to skin infections or wounds to promote healing and reduce inflammation.","Soil: Prefers well-draining, loamy soil rich in organic matter.
Light: Grows well in full sun to partial shade.
Water: Water regularly to keep the soil moist, especially during dry periods.
Temperature: Thrives in tropical and subtropical climates; protect from frost.
Propagation: Grows from seeds or cuttings.
Fertilizer: Apply balanced fertilizer to promote healthy growth during the growing season.",https://youtu.be/OaL0tAfJ1Tk,Acalypha indica
Europe,Lavender,Lavandula angustifolia,"English lavender, Garden lavender","Native to the Mediterranean, now grown throughout Europe in dry, sunny climates with well-draining soil.","Calming and relaxation: Lavender is widely used in aromatherapy for its calming and soothing effects. It helps reduce stress, anxiety, and promotes sleep.
Skin care: Lavender oil is used to treat minor burns, cuts, and insect bites. It has antiseptic and anti-inflammatory properties that promote healing.
Pain relief: Lavender oil, when massaged into the skin, helps relieve joint and muscle pain.
Digestive aid: Lavender tea can alleviate digestive issues such as bloating, nausea, and indigestion.","Lavender tea: Steep 1-2 teaspoons of dried lavender flowers in hot water for 5-10 minutes. Strain and enjoy to reduce anxiety or aid digestion.
Lavender oil for skin: Dilute a few drops of lavender essential oil in a carrier oil (such as coconut or olive oil) and apply to the skin to heal burns or insect bites.
Lavender bath: Add a few drops of lavender essential oil to your bathwater to promote relaxation and relieve stress.","Lavender prefers well-draining, slightly alkaline soil and full sun. It grows well in pots or garden beds.
Water sparingly: Lavender thrives in dry conditions, so only water when the soil is dry to the touch.
Pruning: Regular pruning helps maintain the plant’s shape and encourages bushy growth.
Propagation: Lavender is easily propagated from cuttings or seeds.",https://youtu.be/4WnzmNph-wM,Lavender
Europe,Chamomile,Matricaria chamomilla,"German chamomile, Wild chamomile","Found in dry fields, meadows, and gardens throughout Europe, especially in well-drained soils.","Sleep aid: Chamomile is famous for its ability to promote relaxation and improve sleep quality.
Digestive support: Chamomile tea helps relieve indigestion, bloating, and gas.
Anti-inflammatory: Chamomile is effective in reducing inflammation in conditions such as arthritis and sore muscles.
Skin care: Chamomile helps soothe skin irritation and reduce redness caused by conditions like eczema.","Chamomile tea: Steep 1 tablespoon of dried chamomile flowers in hot water for 5-10 minutes. Strain and drink before bedtime for better sleep.
Chamomile compress: Soak a cloth in chamomile tea and apply it to inflamed skin or tired eyes to reduce irritation.
Chamomile bath: Add a cup of brewed chamomile tea to your bath to calm the skin and reduce stress.","Chamomile grows well in full sun and sandy, well-draining soil.
Water: Water regularly, but avoid overwatering. Chamomile prefers slightly dry conditions.
Propagation: Sow chamomile seeds directly into the soil in early spring. It can also be propagated by dividing existing plants.
Pruning: Deadhead spent flowers to encourage continued blooming.",https://youtu.be/yzEXf_gQbkQ,Chamomile
Europe,St. John's Wort,Hypericum perforatum,"St. John's Wort, Hypericum","Native to Europe, it grows in sunny meadows, roadsides, and woodlands with well-draining soil.","Antidepressant: St. John’s Wort is known for its mood-enhancing properties and is commonly used to treat mild to moderate depression.
Wound healing: The herb’s oil is used to treat cuts, burns, and bruises due to its anti-inflammatory and antiseptic properties.
Pain relief: It helps relieve nerve pain and muscle aches.","St. John’s Wort tea: Steep 1-2 teaspoons of dried St. John’s Wort in hot water for 5-10 minutes. Drink to reduce symptoms of depression or anxiety.
St. John’s Wort oil: Infuse dried St. John’s Wort flowers in olive oil for several weeks. Apply to the skin to heal wounds and relieve muscle pain.
St. John’s Wort tincture: Mix 1-2 teaspoons of St. John’s Wort tincture with water and consume to alleviate depression.","St. John’s Wort prefers full sun and dry, well-draining soil.
Water: Water sparingly, as the plant is drought-tolerant.
Pruning: Cut back dead stems in early spring to encourage fresh growth.
Propagation: St. John’s Wort can be propagated by seeds, cuttings, or root division.",https://youtu.be/LG_lRlkyOTg,St_Johns_Wort
Europe,Yarrow,Achillea millefolium,"Common yarrow, Soldier’s woundwort","Found in grasslands, meadows, and open woods throughout Europe. It prefers well-drained soil and full sun.","Wound healing: Yarrow has been used for centuries to stop bleeding and promote wound healing.
Anti-inflammatory: Yarrow helps reduce inflammation and relieve pain in conditions such as arthritis.
Digestive aid: It can help alleviate digestive issues like indigestion and bloating.
Fever reduction: Yarrow tea can help lower fevers by inducing sweating.","Yarrow tea: Steep 1-2 teaspoons of dried yarrow flowers in hot water for 5-10 minutes. Drink to reduce fever or improve digestion.
Yarrow poultice: Crush fresh yarrow leaves and apply directly to cuts or wounds to stop bleeding and promote healing.
Yarrow tincture: Mix yarrow tincture with water and consume to reduce inflammation and pain.","Yarrow thrives in full sun and well-drained soil.
Water: Yarrow is drought-tolerant and prefers dry conditions. Water sparingly.
Propagation: Yarrow can be grown from seeds or divided clumps in the spring.
Pruning: Trim back the plant after flowering to encourage fresh growth.",https://youtu.be/3aVfnS2cEzE,Yarrow
Europe,Elderberry,Sambucus nigra,"European elder, Black elder","Grows in hedgerows, woodlands, and along roadsides throughout Europe. Prefers moist, well-drained soil and full sun to partial shade.","Immune booster: Elderberries are rich in antioxidants and vitamins that support immune health.
Cold and flu relief: Elderberry syrup is commonly used to relieve symptoms of colds and flu.
Anti-inflammatory: The berries have anti-inflammatory properties, which help reduce pain and swelling.","Elderberry syrup: Simmer 1 cup of fresh or dried elderberries with 2 cups of water and 1 cup of honey. Strain the mixture and store in a jar. Take 1-2 tablespoons daily to boost immunity.
Elderberry tea: Steep 1 tablespoon of dried elderberries in hot water for 5-10 minutes. Strain and drink to reduce cold symptoms.
Elderberry tincture: Mix elderberry tincture with water and consume to relieve cold and flu symptoms.","Elderberry prefers moist, well-drained soil and full sun to partial shade.
Water: Water regularly, especially during dry periods.
Propagation: Elderberry can be propagated by seeds, cuttings, or division.
Pruning: Prune back dead or damaged branches in late winter to early spring.",https://youtu.be/qA1TIm6gX34,Elderberry
Europe,Sneezewort,Achillea ptarmica,"Sneezewort, Wild Sneezewort","Native to Europe, it grows in moist meadows, along riverbanks, and in marshy areas.","Respiratory health: Sneezewort has been used to treat coughs, colds, and asthma.
Anti-inflammatory: It helps reduce inflammation in muscles and joints.
Fever reduction: Sneezewort tea is used to lower fevers and support immune function.","Sneezewort tea: Steep 1 teaspoon of dried sneezewort in hot water for 10 minutes. Drink to relieve coughs and reduce fever.
Sneezewort poultice: Apply crushed fresh sneezewort leaves to swollen or inflamed areas to reduce pain.","Sneezewort prefers full sun or partial shade and moist, well-drained soil.
Water: Keep the soil moist, especially during dry periods.
Propagation: Propagate by seed or by dividing clumps in spring.
Pruning: Deadhead the plant after flowering to encourage more blooms.",https://youtu.be/6aPtHZKN1bg,Sneezewort
Europe,Pheasant's Eye,Adonis aestivalis,"Pheasant's Eye, Summer Pheasant's Eye","Native to southern and central Europe, found in fields, meadows, and along roadsides.","Cardiovascular health: Traditionally used to strengthen the heart and improve circulation.
Sedative: It has mild sedative properties and can be used to relieve anxiety.
Diuretic: Helps promote urination and alleviate fluid retention.","Pheasant's Eye infusion: Steep 1 teaspoon of dried plant material in hot water for 10 minutes. Drink to support heart health.
Pheasant's Eye tincture: Use a few drops diluted in water to alleviate mild anxiety.","Pheasant's Eye prefers full sun and well-drained soil.
Water: Water sparingly, allowing the soil to dry out between watering.
Propagation: Best grown from seed, sown directly into the soil in early spring.
Pruning: Deadhead spent flowers to prolong the blooming period.",https://youtu.be/_RjOCGbsF-E,Pheasant's_Eye
Europe,Pheasant's Eye (Adonis),Adonis annua,"Pheasant's Eye, Adonis","Native to the Mediterranean region and southern Europe, found in grassy fields and dry, open areas.","Heart health: Used in traditional medicine to support heart function and improve circulation.
Anti-inflammatory: Helps reduce inflammation in conditions like arthritis.
Mild sedative: Used to calm anxiety and promote relaxation.","Adonis tea: Steep 1 teaspoon of dried Adonis flowers in hot water for 10 minutes. Drink to support heart health and reduce inflammation.
Adonis tincture: Use a few drops in water to alleviate anxiety.","Adonis prefers full sun and dry, well-drained soil.
Water: Water only when the soil is completely dry.
Propagation: Adonis is best grown from seed, sown directly outdoors in early spring.
Pruning: Deadhead flowers to encourage new blooms.",https://youtu.be/2gRcV1tKkdw,Pheasants_Eye_Adonis
Europe,Horse Chestnut,Aesculus hippocastanum,"Horse Chestnut, Conker Tree","Native to the Balkans, it is now commonly found in parks and gardens throughout Europe.","Varicose veins: Horse chestnut is commonly used to reduce symptoms of varicose veins and improve blood circulation.
Anti-inflammatory: Used to reduce inflammation in conditions such as arthritis.
Hemorrhoid relief: Horse chestnut extract is used to alleviate hemorrhoid symptoms.","Horse chestnut extract: Apply topically to affected areas to reduce swelling and pain from varicose veins.
Horse chestnut tincture: Mix a few drops in water and consume to improve circulation and reduce inflammation.","Horse chestnut prefers full sun and deep, well-drained soil.
Water: Water regularly, especially during dry periods.
Propagation: Propagate by seeds (conkers) collected in autumn and planted in early spring.
Pruning: Prune to maintain shape and remove dead or damaged branches.",https://youtu.be/aYV1kK5HFLc,Horse_Chestnut
Europe,Agrimony,Agrimonia eupatoria,"Agrimony, Church Steeples, Sticklewort","Found in meadows, hedgerows, and roadsides throughout Europe, often in dry, well-drained soils.","Digestive health: Agrimony is used to alleviate diarrhea and indigestion.
Wound healing: It has been traditionally used to heal wounds and stop bleeding.
Respiratory health: Agrimony tea is used to soothe sore throats and relieve coughs.","Agrimony tea: Steep 1 teaspoon of dried agrimony leaves in hot water for 10 minutes. Drink to relieve indigestion or sore throat.
Agrimony poultice: Crush fresh agrimony leaves and apply to wounds to promote healing.","Agrimony prefers full sun and well-drained soil.
Water: Water regularly, but do not overwater as it prefers slightly dry conditions.
Propagation: Propagate by seeds or division in spring.
Pruning: Deadhead spent flowers to encourage continuous blooming.",https://youtu.be/5p7nL3Q-0V8,Agrimony
Europe,Corn Cockle,Agrostemma githago,"Corn Cockle, Field Cockle","Common in fields and meadows throughout Europe, especially in disturbed soils.","Detoxification: Traditionally used to promote the elimination of toxins from the body.
Anti-inflammatory: Helps reduce inflammation and pain in arthritis and sore muscles.
Skin health: Used to treat skin infections and promote healing.","Corn Cockle tea: Steep 1 teaspoon of dried corn cockle in hot water for 10 minutes. Drink to support detoxification and reduce inflammation.
Corn Cockle poultice: Crush fresh leaves and apply to inflamed or infected skin areas.","Corn Cockle prefers full sun and well-drained soil.
Water: Water sparingly, as it prefers dry conditions.
Propagation: Best grown from seeds, sown directly outdoors in early spring.
Pruning: Deadhead spent flowers to encourage continuous blooming.",https://youtu.be/bFH5LCFVjLk,Corn_Cockle
