continent,name,botanicalName,commonNames,habitat,medicinalUses,medicinalRecipe,methodsOfCultivation,videos,modelBasePath
Europe,Bugle,Ajuga reptans,"Bugle, Carpet Bugleweed, Blue Bugle","Found in damp meadows, woods, and pastures across Europe, especially in shaded or semi-shaded areas.","Wound healing: Bugle has been used traditionally to heal wounds and reduce bleeding.
Respiratory health: It helps soothe sore throats and relieve coughs.
Anti-inflammatory: Bugle is used to reduce inflammation and promote healing in arthritis and muscle injuries.","Bugle tea: Steep 1 teaspoon of dried bugle leaves in hot water for 10 minutes. Drink to soothe sore throats and reduce inflammation.
Bugle poultice: Apply crushed bugle leaves to wounds to promote healing.","Bugle prefers partial shade and moist, well-drained soil.
Water: Keep the soil consistently moist, especially in dry periods.
Propagation: Propagate by division in early spring or by seeds sown in fall.
Pruning: Trim back after flowering to maintain compact growth.",https://youtu.be/6JfPj9dqLrY,Bugle
North-America,Pride of Barbados,Caesalpinia pulcherrima,"['Pride of Barbados', 'Peacock Flower']","Commonly found in tropical and subtropical regions, often in gardens and along roadsides.","Fever reducer: Used to lower fever and treat respiratory issues.
Antimicrobial: Helps fight infections and heal wounds.",Peacock Flower tea: Steep 1 teaspoon of dried flowers in hot water for 10 minutes. Drink to help reduce fever and soothe respiratory issues.,"Prefers well-drained, sandy soil and full sunlight.
Water: Water moderately, ensuring soil does not become too dry.
Propagation: Easily propagated by seeds or cuttings.",https://youtu.be/XXXXXX,Caesalpinia_pulcherrima
North-America,Dream Herb,Calea ternifolia,"['Dream Herb', 'Leaf of God']","Native to Mexico and Central America, often found in mountainous regions and open forests.","Dream enhancement: Traditionally used to promote vivid dreaming and improve dream recall.
Relaxant: Helps induce relaxation and reduce stress.",Dream Herb tea: Steep 1 teaspoon of dried leaves in hot water for 10 minutes before bedtime. Drink to enhance dreams and promote relaxation.,"Prefers well-drained, sandy soil in partial to full sunlight.
Water: Water moderately, keeping soil slightly moist.
Propagation: Grows well from seeds or stem cuttings.",https://youtu.be/XXXXXX,Calea_ternifolia
North-America,Marsh Marigold,Caltha palustris,['Marsh Marigold'],"Grows in wetlands, marshes, and along streams in North America.","Skin treatment: Traditionally used to treat skin conditions such as warts and sores.
Diuretic: Helps promote urination and alleviate water retention.",Marsh Marigold poultice: Mash fresh leaves and apply to affected skin areas to treat warts and sores.,"Prefers moist, marshy soil and partial sunlight.
Water: Requires consistently moist soil, ideal for wet environments.
Propagation: Propagated by seeds or dividing plants in early spring.",https://youtu.be/XXXXXX,Caltha_palustris
North-America,Chili Pepper,Capsicum annuum,"['Chili Pepper', 'Bell Pepper']",Widely cultivated across North America in warm climates and gardens.,"Anti-inflammatory: Known for its capsaicin content, which reduces pain and inflammation.
Digestive health: Promotes digestive health and improves circulation.","Chili Pepper poultice: Crush fresh chili peppers and apply to painful areas to relieve muscle pain.
Pepper tea: Steep a few pepper flakes in hot water for 5 minutes. Drink to support digestion.","Prefers well-drained soil and full sunlight.
Water: Water regularly, allowing soil to dry between waterings.
Propagation: Grows easily from seeds.",https://youtu.be/XXXXXX,Capsicum_annuum
South-America,Common Carpet Grass,Acanthospermum australe,"['Common Carpet Grass', 'Yellow Thistle']","Found in tropical and subtropical regions, often in grasslands and along roadsides.","Antibacterial: Used to treat skin infections and wounds.
Anti-inflammatory: Helps reduce inflammation and pain.",Carpet Grass poultice: Crush fresh leaves and apply to wounds or inflamed areas for relief.,"Prefers well-drained, sandy soil and full sunlight.
Water: Water moderately, allowing soil to dry between watering.
Propagation: Grows well from seeds.",https://youtu.be/XXXXXX,Acanthospermum_australe
South-America,Marcelinha,Achyrocline saturejoides,"['Marcelinha', 'Yellow Button']","Native to South America, commonly found in fields and open areas.","Digestive health: Used to relieve indigestion and stomach discomfort.
Anti-inflammatory: Reduces inflammation and pain in muscles and joints.",Marcelinha tea: Steep 1 teaspoon of dried flowers in hot water for 10 minutes. Drink to relieve indigestion.,"Prefers well-drained soil and full sunlight.
Water: Water regularly, but avoid waterlogging the soil.
Propagation: Can be propagated from seeds or cuttings.",https://youtu.be/XXXXXX,Achyrocline_saturejoides
South-America,Toothache Plant,Acmella oleracea,"['Toothache Plant', 'Paracress']",Commonly grows in tropical and subtropical regions of South America.,"Pain relief: Used to numb toothaches and other oral pain.
Antifungal: Helps treat fungal infections and skin conditions.",Toothache Plant tincture: Chew fresh leaves or apply crushed leaves to gums to relieve oral pain.,"Prefers well-drained, fertile soil in full sunlight.
Water: Water regularly, but avoid waterlogging.
Propagation: Grows easily from seeds or cuttings.",https://youtu.be/XXXXXX,Toothache Plant
South-America,Sage of the Andes,Aloysia citrodora,"['Sage of the Andes', 'Lemon Verbena']","Native to South America, grows in warm and sunny regions.","Digestive aid: Helps alleviate digestive problems such as bloating and indigestion.
Relaxant: Known for its calming effects on the nervous system.",Lemon Verbena tea: Steep 1 teaspoon of dried leaves in hot water for 10 minutes. Drink to support digestion and relaxation.,"Prefers well-drained, fertile soil in full sunlight.
Water: Water moderately, allowing the soil to dry between watering.
Propagation: Can be grown from seeds or cuttings.",https://youtu.be/XXXXXX,Aloysia_citrodora
South-America,Wild Amaranth,Amaranthus spinosus,"['Wild Amaranth', 'Spiny Amaranth']","Found in tropical and subtropical regions, often in disturbed areas such as roadsides and fields.","Blood purifier: Traditionally used to cleanse the blood and treat anemia.
Anti-inflammatory: Reduces inflammation and swelling.",Amaranth decoction: Boil 1 tablespoon of dried leaves in water for 10 minutes. Drink to support blood health.,"Prefers well-drained, fertile soil in full sunlight.
Water: Water regularly, but avoid waterlogging.
Propagation: Easily propagated by seeds.",https://youtu.be/XXXXXX,Amaranthus_spinosus
Australia,Tea Tree,Melaleuca alternifolia,Tea Tree,"Native to the coastal regions of New South Wales and Queensland, Australia.","Antiseptic: Widely used as a natural antiseptic for minor cuts, burns, and infections.
Anti-inflammatory: Helps reduce inflammation and redness in conditions like acne and eczema.
Antifungal: Effective against fungal infections such as athlete's foot and ringworm.
Decongestant: Used in steam inhalations to relieve nasal congestion and respiratory issues.
Skin care: Helps treat acne, dandruff, and other skin conditions due to its antimicrobial properties.","Tea Tree oil application: Dilute a few drops of Tea Tree oil in a carrier oil and apply to affected areas for treating infections or acne.
Steam inhalation: Add a few drops of Tea Tree oil to a bowl of hot water, cover your head with a towel, and inhale the steam to relieve respiratory congestion.","Soil: Prefers well-draining, sandy or loamy soil.
Light: Requires full sunlight for optimal growth.
Water: Water regularly but avoid waterlogging; well-drained soil is crucial.
Temperature: Thrives in warm, temperate climates; protect from frost.
Propagation: Grown from seeds or cuttings.
Fertilizer: Apply a balanced fertilizer during the growing season to support healthy growth.",https://youtu.be/8IhY11T1-Q8,Tea Tree
Australia,Eucalyptus,Eucalyptus globulus,"Blue Gum, Eucalyptus","Found throughout Australia in a variety of habitats, including forests and woodlands.","Expectorant: Helps clear mucus and ease coughs and bronchitis.
Antiseptic: Used for its antiseptic properties to treat wounds and infections.
Anti-inflammatory: Reduces inflammation and can help with conditions like arthritis.
Respiratory health: Provides relief from congestion and sinusitis when used in steam inhalations.
Pain relief: Can be used topically to relieve muscle and joint pain.","Eucalyptus oil steam: Add a few drops of Eucalyptus oil to hot water, cover your head with a towel, and inhale the steam to relieve respiratory symptoms.
Topical application: Dilute Eucalyptus oil in a carrier oil and apply to sore muscles or joints for pain relief.","Soil: Prefers well-draining, sandy to loamy soil.
Light: Requires full sunlight for optimal growth.
Water: Water regularly, particularly during dry periods, but avoid waterlogging.
Temperature: Thrives in warm climates; some species are frost-sensitive.
Propagation: Grown from seeds or cuttings.
Fertilizer: Apply a balanced fertilizer during the growing season to promote healthy growth.",https://youtu.be/FG6-IzI9X9k,Eucalyptus
Australia,Kakadu Plum,Terminalia ferdinandiana,"Kakadu Plum, Gubinge",Native to the tropical woodlands and savannas of northern Australia.,"High Vitamin C: Rich in Vitamin C, helps boost the immune system and improve skin health.
Antioxidant: Contains powerful antioxidants that protect against oxidative stress and inflammation.
Anti-inflammatory: Helps reduce inflammation and improve overall health.
Skin care: Used in cosmetics and skincare products for its nourishing and rejuvenating properties.
Digestive health: Traditionally used to support digestive health and treat gastrointestinal issues.","Kakadu Plum powder: Add Kakadu Plum powder to smoothies or juices for an immune boost and increased Vitamin C intake.
Topical application: Incorporate Kakadu Plum extract into skincare products to benefit from its antioxidant and anti-inflammatory properties.","Soil: Prefers well-draining, sandy or loamy soil.
Light: Requires full sunlight for optimal growth.
Water: Water moderately, allowing the soil to dry between waterings.
Temperature: Thrives in tropical and subtropical climates; protect from frost.
Propagation: Grown from seeds or cuttings.
Fertilizer: Apply a balanced fertilizer during the growing season to support healthy growth.",https://youtu.be/QzTcSrxFQ8M,Kakadu Plum
Australia,Quandong,Santalum acuminatum,"Quandong, Desert Quandong","Found in arid and semi-arid regions of Australia, especially in the central and western parts.","Digestive health: Traditionally used to relieve digestive issues and improve gut health.
Antioxidant: Rich in antioxidants that help combat oxidative stress and inflammation.
Skin care: Used in traditional remedies for skin conditions and to improve skin health.
Immune system support: Supports overall immune health due to its high vitamin content.
Anti-inflammatory: Helps reduce inflammation and associated symptoms.","Quandong jam: Cook Quandong fruits with sugar to make a jam that can be used as a nutritious spread.
Quandong extract: Prepare an extract from the fruit for use in traditional remedies and skin care products.","Soil: Prefers well-draining, sandy soil.
Light: Requires full sunlight for optimal growth.
Water: Water sparingly; drought-tolerant once established.
Temperature: Thrives in arid and semi-arid climates; highly frost-tolerant.
Propagation: Grown from seeds; may require scarification to enhance germination.
Fertilizer: Minimal fertilization is needed; occasional application of a balanced fertilizer can support growth.",https://youtu.be/2k3k-a2GThs,Quandong
Australia,Riberry,Ribes rubrum,"Riberry, Cranberry",Native to the eastern and southeastern regions of Australia.,"Antioxidant: High in antioxidants, helps combat oxidative stress and support overall health.
Digestive health: Traditionally used to improve digestion and treat gastrointestinal issues.
Immune support: Boosts immune function due to its rich vitamin C content.
Anti-inflammatory: Helps reduce inflammation and supports joint health.
Skin health: Used in traditional medicine for its potential benefits to skin health and vitality.","Riberry juice: Drink Riberry juice to benefit from its high antioxidant and vitamin content.
Riberry jam: Make jam from Riberries to enjoy its health benefits and use it as a nutritious spread.","Soil: Prefers well-draining, fertile soil.
Light: Grows best in full sunlight or partial shade.
Water: Requires regular watering, particularly during dry periods.
Temperature: Thrives in temperate climates; protect from extreme frost.
Propagation: Grown from seeds or cuttings.
Fertilizer: Apply a balanced fertilizer during the growing season to support healthy growth.",https://youtu.be/5fW4b2FxaTg,Riberry
