continent,name,botanicalName,commonNames,habitat,medicinalUses,medicinalRecipe,methodsOfCultivation,videos,modelBasePath
Asia,Mint,"Mentha (various species, including Mentha spicata, Mentha piperita)","Mint, Peppermint, Spearmint","Native to Europe and the Middle East, but now cultivated worldwide. Grows well in temperate climates and can be found near water sources in the wild.","Digestive aid: Mint can help soothe digestive issues, reduce bloating, and relieve indigestion.
Respiratory relief: The menthol in mint can help clear nasal passages and ease respiratory discomfort.
Headache relief: Applying mint oil topically or inhaling its aroma may help alleviate headaches.
Stress reduction: The scent of mint has calming properties that can help reduce stress and anxiety.
Oral health: Mint has natural antibacterial properties that can help freshen breath and promote oral health.
Skin care: When applied topically, mint can help soothe skin irritations and provide a cooling effect.
Nausea relief: Mint tea or the scent of mint can help alleviate nausea and motion sickness.","Mint tea: Steep fresh or dried mint leaves in hot water for 5-10 minutes. Drink to aid digestion or relieve stress.
Mint-infused water: Add fresh mint leaves to cold water and let it infuse for a refreshing, hydrating drink.
Mint compress: Wrap crushed mint leaves in a cloth and apply to the forehead for headache relief.
Mint and honey syrup: Simmer mint leaves in water, strain, and add honey. Use for coughs or as a natural sweetener.","Soil: Mint prefers rich, moist soil with good drainage. It can tolerate a wide range of pH levels but prefers slightly acidic to neutral soil.
Climate: Mint grows well in temperate climates and can tolerate some shade. It prefers temperatures between 55°F to 70°F (13°C to 21°C).
Planting: Plant mint in spring after the last frost. Due to its invasive nature, it's often best grown in containers.
Watering: Keep the soil consistently moist. Water deeply once or twice a week, or more frequently in hot weather.
Sunlight: Mint can grow in full sun to partial shade. In hotter climates, some afternoon shade is beneficial.
Fertilizer: Mint doesn't require much fertilizer. A light application of balanced, organic fertilizer in spring is usually sufficient.
Pruning: Regularly pinch off the top leaves to encourage bushier growth and prevent flowering, which can affect flavor.
Harvesting: Begin harvesting leaves when the plant reaches 3-4 inches tall. Harvest regularly to promote growth and prevent overgrowth.",https://youtu.be/USn98WjBksw?si=2eTp_8DbJ7LOACzR,Mint
Asia,Brahmi,Bacopa monnieri,"Brahmi, Water hyssop, Herb of grace","Native to wetlands of southern and Eastern India, Australia, Europe, Africa, Asia, and North and South America. Thrives in damp, marshy areas.","Cognitive enhancement: Brahmi is known for its potential to improve memory, concentration, and overall cognitive function.
Anxiety relief: Brahmi has adaptogenic properties that may help reduce anxiety and stress.
Antioxidant: Rich in antioxidants, which help protect cells from damage by free radicals.
Anti-inflammatory: Brahmi may help reduce inflammation in the body, potentially beneficial for conditions like arthritis.
Antidepressant: Some studies suggest Brahmi may have natural antidepressant effects.
Skin health: Brahmi can be used topically to help heal wounds, reduce scars, and promote skin regeneration.
Epilepsy and seizures: Brahmi has been traditionally used in Ayurvedic medicine to help manage epilepsy and seizures.","Brahmi tea: Steep dried Brahmi leaves in hot water for 5-10 minutes. Drink daily to support cognitive health.
Brahmi oil: Infuse Brahmi leaves in coconut oil and use for scalp massage to promote hair growth and relieve stress.
Brahmi powder: Mix Brahmi powder with water or juice and consume daily for its cognitive benefits.
Brahmi and ghee: Mix Brahmi powder with warm ghee and take a small amount daily to improve memory and focus.","Soil: Brahmi prefers moist, nutrient-rich soil. It thrives in soil with good water retention, such as loamy or clay soil.
Climate: Brahmi grows best in tropical and subtropical climates, requiring temperatures between 59°F to 95°F (15°C to 35°C).
Planting: Propagate using stem cuttings or seeds. Plant in pots or directly in the garden, keeping the soil consistently moist.
Watering: Brahmi needs regular watering to keep the soil wet, as it thrives in marshy environments.
Sunlight: Brahmi prefers partial shade to full sun. In hotter regions, provide some afternoon shade.
Fertilizer: Feed with organic compost or a balanced fertilizer every 4-6 weeks during the growing season.
Pruning: Regularly trim the plant to encourage bushier growth and prevent it from becoming too leggy.
Harvesting: Harvest leaves and stems regularly once the plant is well-established, usually after 6-8 weeks of growth.",https://youtu.be/McaQWb6AZg4?si=yOfHATCC4nzb4J0F,Brahmi
Asia,Ginseng,Panax ginseng,"Asian ginseng, Korean ginseng, Chinese ginseng","Native to the mountainous forests of East Asia, particularly Korea, northeastern China, and eastern Siberia. Prefers cool, shaded areas with well-draining soil.","Energy boost: Ginseng is known for its ability to fight fatigue and increase energy levels.
Cognitive function: May improve mental clarity, concentration, and memory.
Immune system support: Contains compounds that can help strengthen the immune system.
Stress reduction: Acts as an adaptogen, helping the body cope with physical and mental stress.
Blood sugar regulation: Some studies suggest it may help improve insulin sensitivity and glucose metabolism.
Cardiovascular health: May help lower blood pressure and improve heart health.
Anti-inflammatory: Contains compounds with anti-inflammatory properties.","Ginseng tea: Steep dried ginseng slices in hot water for 5-10 minutes. Drink for energy and overall health.
Ginseng tincture: Soak ginseng root in alcohol for several weeks, then strain. Take a few drops daily diluted in water.
Ginseng honey: Infuse honey with ginseng slices for several weeks. Use as a natural sweetener or energy booster.
Ginseng soup: Simmer ginseng root with chicken and other herbs for a traditional Korean health tonic.","Soil: Ginseng prefers well-draining, slightly acidic soil (pH 5.5-6.0) rich in organic matter.
Climate: Thrives in cool, temperate climates with temperatures between 50°F to 80°F (10°C to 27°C).
Planting: Seeds are typically stratified for 18-22 months before planting. Plant in early spring or fall.
Watering: Keep soil consistently moist but not waterlogged. Ginseng is sensitive to both drought and overwatering.
Sunlight: Requires 70-80% shade. Often grown under natural forest canopy or artificial shade structures.
Fertilizer: Use minimal fertilizer. Excess nutrients can lead to disease. Organic compost can be added sparingly.
Pest control: Protect from rodents and deer. Use organic methods to control fungal diseases.
Harvesting: Roots are typically harvested after 4-6 years for maximum medicinal potency.",https://youtu.be/p3Bu5aGDtPw?si=CIqRHHNNoLgqgI9J,Ginseng
Asia,Huang Qi,Astragalus membranaceus,"Huang Qi, Milk vetch","Native to northern and eastern China, as well as Mongolia. Grows in grasslands, sparse forests, and shrublands.","Immune boost: Astragalus is known for its immune-enhancing properties.
Cardiovascular health: May help lower blood pressure and improve heart function.
Anti-aging: Contains antioxidants that may help protect against cellular damage.
Wound healing: Traditionally used to promote faster wound healing.
Stress reduction: Acts as an adaptogen, helping the body cope with physical and mental stress.
Diabetes management: Some studies suggest it may help improve insulin sensitivity.
Respiratory health: May help strengthen the lungs and improve respiratory function.","Astragalus tea: Simmer dried astragalus root slices in water for 10-15 minutes. Drink daily for immune support.
Astragalus soup: Add astragalus root to chicken or vegetable soup for a nourishing, immune-boosting meal.
Astragalus tincture: Soak astragalus root in alcohol for several weeks, then strain. Take a few drops daily.
Astragalus honey: Infuse honey with astragalus slices for several weeks. Use as a natural sweetener.","Soil: Astragalus prefers well-draining, sandy loam soil with a pH between 6.0-7.0.
Climate: Thrives in temperate to cool climates. Can tolerate temperatures between 50°F to 80°F (10°C to 27°C).
Planting: Sow seeds directly in the garden in spring or start indoors 6-8 weeks before the last frost.
Watering: Water regularly to keep soil moist, especially during dry spells. Avoid waterlogging.
Sunlight: Prefers full sun to partial shade.
Fertilizer: Apply a balanced, organic fertilizer in spring and mid-summer.
Pruning: Not typically necessary, but can be pruned to maintain shape if desired.
Harvesting: Roots are typically harvested after 4-7 years for maximum medicinal potency.",https://youtu.be/5MpPnyf86Wc?si=CbSQAvF-J_xLml44,Huang Qi
Asia,Ashitaba,Angelica keiskei,"Ashitaba, Tomorrow's leaf, Longevity herb","Native to Japan, particularly the Izu Islands and the Izu Peninsula. Grows well in coastal areas with mild climates.","Longevity promotion: Rich in antioxidants that may help slow aging processes.
Digestive health: May help improve digestion and relieve gastrointestinal discomfort.
Wound healing: Contains compounds that can accelerate wound healing when applied topically.
Cardiovascular health: May help lower cholesterol and improve circulation.
Blood sugar regulation: Some studies suggest it may help manage blood sugar levels.
Liver support: May have hepatoprotective properties, supporting liver health.
Anti-inflammatory: Contains compounds with potent anti-inflammatory effects.","Ashitaba tea: Steep dried ashitaba leaves in hot water for 5-10 minutes. Drink for overall health benefits.
Ashitaba powder supplement: Mix ashitaba powder into smoothies or juices for a nutritional boost.
Ashitaba salad: Use fresh ashitaba leaves in salads for a nutritious, slightly bitter flavor.
Ashitaba topical paste: Crush fresh leaves and apply to minor wounds or skin irritations.","Soil: Ashitaba prefers well-draining, fertile soil. It can tolerate poor soil but thrives in rich, loamy soil.
Climate: Grows best in mild, coastal climates. Prefers temperatures between 60°F to 80°F (15°C to 27°C).
Planting: Sow seeds in spring or propagate from root divisions. Plant in full sun to partial shade.
Watering: Keep soil consistently moist but not waterlogged. Water deeply once or twice a week.
Sunlight: Prefers full sun but can tolerate partial shade, especially in hotter climates.
Fertilizer: Apply a balanced, organic fertilizer in spring and mid-summer.
Pruning: Regularly remove older leaves to encourage new growth.
Harvesting: Leaves can be harvested year-round. The plant regenerates quickly, often growing new leaves within a day.",https://youtu.be/pxJLhqXJS3Q?si=BY498bkyzGuOpD_h,Huang Qi
Asia,Tongkat Ali,Eurycoma longifolia,"Tongkat Ali, Longjack, Malaysian Ginseng","Native to Southeast Asian countries including Malaysia, Indonesia, and Vietnam. Grows in rainforests and is often found on sandy soil.","Male health: Traditionally used to enhance male vitality and fertility.
Stress reduction: Acts as an adaptogen, helping the body cope with physical and mental stress.
Energy boost: May help combat fatigue and increase energy levels.
Muscle strength: Some studies suggest it may help increase muscle strength and mass.
Bone health: May help improve bone density and reduce risk of osteoporosis.
Anti-inflammatory: Contains compounds with anti-inflammatory properties.
Antimalarial: Traditionally used in some cultures to treat malaria.","Tongkat Ali tea: Steep dried Tongkat Ali root in hot water for 10-15 minutes. Drink for energy and vitality.
Tongkat Ali extract: Take commercially prepared Tongkat Ali extract as directed for general health benefits.
Tongkat Ali coffee: Add Tongkat Ali powder to your morning coffee for an energy boost.
Tongkat Ali smoothie: Blend Tongkat Ali powder into fruit smoothies for added nutrition.","Soil: Tongkat Ali prefers well-draining, sandy soil with a pH between 6.0-6.5.
Climate: Thrives in tropical climates with high humidity. Prefers temperatures between 77°F to 95°F (25°C to 35°C).
Planting: Usually propagated from seeds. Plant in partial shade, mimicking its natural rainforest habitat.
Watering: Requires regular watering to maintain consistent soil moisture. Avoid waterlogging.
Sunlight: Prefers partial shade, similar to its natural understory habitat in rainforests.
Fertilizer: Apply a balanced, organic fertilizer every 2-3 months during the growing season.
Pruning: Minimal pruning required. Remove dead or damaged branches as needed.
Harvesting: Roots are typically harvested after 5-7 years for maximum medicinal potency.",https://youtu.be/c7XIKpnqkrs?si=TZNedz-DdVR_hzw4,Tongkat Ali
Asia,Tulsi,Ocimum sanctum or Ocimum tenuiflorum,"Tulsi, Holy Basil, Sacred Basil",Native to the Indian subcontinent and widespread as a cultivated plant throughout the Southeast Asian tropics. Grows well in tropical and subtropical climates.,"Stress reduction: Known as an adaptogen, helping the body cope with physical, emotional, and environmental stress.
Respiratory health: May help alleviate symptoms of respiratory disorders like asthma and bronchitis.
Immune support: Contains compounds that can help boost the immune system.
Anti-inflammatory: Has potent anti-inflammatory properties that may help in various health conditions.
Digestive aid: Can help improve digestion and relieve gastrointestinal discomfort.
Blood sugar regulation: May help in managing blood sugar levels, potentially beneficial for diabetics.
Oral health: Chewing tulsi leaves or using tulsi mouthwash may promote oral health due to its antimicrobial properties.","Tulsi tea: Steep fresh or dried tulsi leaves in hot water for 5-10 minutes. Drink for stress relief and overall health.
Tulsi and ginger infusion: Boil tulsi leaves with fresh ginger slices. Strain and add honey for a soothing drink.
Tulsi-infused water: Add fresh tulsi leaves to room temperature water and let it infuse overnight. Drink throughout the day.
Tulsi face pack: Make a paste of tulsi leaves and mix with honey. Apply to face for 15 minutes for skin health.","Soil: Tulsi prefers well-draining, fertile soil rich in organic matter. It can grow in a variety of soil types but thrives in loamy soil with a pH between 6.0-7.5.
Climate: Grows best in warm, tropical climates. Prefers temperatures between 65°F to 85°F (18°C to 29°C).
Planting: Can be grown from seeds or cuttings. Plant after the last frost in spring, or year-round in tropical climates.
Watering: Water regularly to keep the soil moist but not waterlogged. Tulsi is somewhat drought-tolerant once established.
Sunlight: Prefers full sun but can tolerate partial shade, especially in very hot climates.
Fertilizer: Apply a balanced, organic fertilizer every 4-6 weeks during the growing season. Tulsi also responds well to regular applications of compost tea.
Pruning: Pinch off the top sets of leaves regularly to encourage bushier growth and prevent early flowering.
Harvesting: Leaves can be harvested throughout the growing season. For the best flavor and medicinal properties, harvest in the morning after the dew has dried but before the heat of the day.",https://youtu.be/Yh1iMHA9Fb4?si=3CWRvNwMFzs70aAz,Amla
Asia,Leguminosae (Fabaceae),Various species,"Legumes, Pea Family","Diverse habitats across Asia, including temperate, tropical, and subtropical regions.","Nutritional value: Legumes are rich in protein, fiber, vitamins, and minerals, making them an essential part of the diet.
Digestive health: High fiber content aids in digestion and helps prevent constipation.
Cardiovascular health: Regular consumption can help lower blood pressure and improve heart health due to their high content of antioxidants and minerals.
Diabetes management: Some legumes have a low glycemic index, helping in blood sugar regulation and diabetes management.
Anti-inflammatory: Certain legumes have anti-inflammatory properties, which can help in reducing inflammation and related diseases.","Legume stew: Prepare a stew with lentils, chickpeas, or beans. Cook with spices and vegetables to enhance flavor and nutritional value.
Bean salad: Combine cooked beans or lentils with vegetables, herbs, and a light dressing for a nutritious, fiber-rich meal.","Soil: Prefers well-draining, fertile soil rich in organic matter.
Light: Requires full sunlight or partial shade, depending on the specific species.
Water: Water regularly to keep the soil moist but not waterlogged.
Temperature: Grows well in a range of climates; some species are frost-sensitive.
Propagation: Grown from seeds, which should be planted after the last frost in temperate climates.
Fertilizer: Legumes often do not require heavy fertilization due to their ability to fix nitrogen in the soil. A balanced fertilizer can be applied if needed.",https://youtu.be/gsq9vY5G9Io,Leguminosae
Africa,Ayangile,Cymbopogon citratus,Lemongrass,"Tropical regions of Africa, especially in East Africa.","Digestive health: Used to relieve digestive problems such as bloating and indigestion.
Anti-inflammatory: Contains compounds that help reduce inflammation and pain.
Antimicrobial: Exhibits antimicrobial properties that can help in treating infections.
Detoxification: Acts as a detoxifier, helping to cleanse the liver and kidneys.
Stress relief: Known for its calming effects, helping to reduce anxiety and stress.","Lemongrass tea: Steep fresh or dried lemongrass in boiling water for 10 minutes. Drink 1-2 cups daily to aid digestion and reduce stress.
Infused oil: Infuse lemongrass in carrier oil and use topically to relieve inflammation and pain.","Soil: Prefers well-draining, fertile soil rich in organic matter.
Light: Requires full sunlight for optimal growth.
Water: Water regularly, keeping the soil moist but not waterlogged.
Temperature: Thrives in warm, tropical climates.
Propagation: Grown from cuttings or division of clumps.
Fertilizer: Apply balanced fertilizer during the growing season to promote vigorous growth.",https://youtu.be/E5pkhzGp1aE,Ayangile
Africa,Baobab,Adansonia digitata,"Upside-down tree, Monkey bread tree",Dry savannas and hot semi-arid regions of Africa.,"Immune system support: Baobab fruit is rich in vitamin C and antioxidants, which help boost the immune system and protect against infections.
Digestive health: The fiber content in baobab helps regulate digestion and prevent constipation.
Anti-inflammatory: Baobab pulp and leaves contain compounds that reduce inflammation and may relieve pain from conditions like arthritis.
Skin care: Baobab oil is used to moisturize dry skin, improve elasticity, and treat skin conditions like eczema.
Wound healing: The leaves, bark, and seeds of the baobab tree have been used traditionally to heal wounds and soothe skin irritations.","Baobab smoothie: Blend 1 tablespoon of baobab powder with 1 banana, 1 cup of almond milk, and a handful of spinach. Drink this nutrient-packed smoothie for a boost of vitamin C and fiber.
Baobab face mask: Mix 1 tablespoon of baobab powder with 1 teaspoon of honey and enough water to form a paste. Apply to your face, leave for 15 minutes, and then rinse off with warm water for radiant skin.","Soil: Baobab trees thrive in well-draining, sandy soils with low fertility.
Light: These trees need full sun exposure for optimal growth.
Water: Water the plant occasionally, but make sure the soil dries out completely between waterings.
Temperature: Baobab trees prefer warm temperatures and cannot survive in frost conditions.
Propagation: The baobab can be propagated from seeds, which should be soaked in warm water for 24 hours before planting.
Fertilizer: No specific fertilization is required, as baobabs are adapted to nutrient-poor soils.",https://youtu.be/JpAXj_KW6as,Baobab
Africa,Devil's Claw,Harpagophytum procumbens,"Grapple plant, Wood spider","Sandy and arid areas of southern Africa, particularly Namibia and Botswana.","Anti-inflammatory: Devil's claw is used to reduce pain and inflammation, especially in arthritis and lower back pain.
Digestive health: It stimulates digestion and has been used to treat indigestion and loss of appetite.
Pain relief: Its roots are traditionally used to alleviate muscle pain and headaches.
Skin health: Used in ointments, it helps treat skin conditions such as ulcers and boils.","Devil's claw tea: Add 1-2 teaspoons of dried devil’s claw root to 1 cup of boiling water. Let it steep for 10 minutes, then strain and drink to help with arthritis pain.
Devil's claw ointment: Mix 1 tablespoon of devil’s claw powder with enough coconut oil to form a paste. Apply to sore joints and muscles.","Soil: Grows well in sandy, well-draining soil with low nutrient content.
Light: Prefers full sun.
Water: Water the plant sparingly; it is drought-tolerant.
Temperature: Grows best in warm, arid climates.
Propagation: Can be grown from seeds. Seeds should be soaked in water before planting.
Fertilizer: Minimal fertilization is needed, as it thrives in nutrient-poor soils.",https://youtu.be/ZLkOZZhFxuQ,Devils Claw
Africa,Sutherlandia,Sutherlandia frutescens,Cancer bush,Semi-arid regions of southern Africa.,"Immune system support: Sutherlandia is believed to strengthen the immune system and is often used by HIV/AIDS patients.
Anti-cancer: Traditionally used to treat various types of cancer, though scientific evidence is limited.
Anti-inflammatory: Helps reduce inflammation and may relieve symptoms of arthritis and asthma.
Stress relief: Sutherlandia has adaptogenic properties, helping the body cope with stress.
Blood sugar regulation: It is used to manage diabetes by regulating blood sugar levels.","Sutherlandia tea: Steep 1 teaspoon of dried sutherlandia leaves in 1 cup of boiling water for 5-10 minutes. Strain and drink to boost immunity.
Sutherlandia tincture: Mix 1 tablespoon of sutherlandia leaves in 100ml of vodka. Store in a dark place for 2 weeks, shaking daily. Strain and take 10 drops daily.","Soil: Grows best in well-drained, sandy soil.
Light: Requires full sun for optimal growth.
Water: Water occasionally, allowing the soil to dry between waterings.
Temperature: Prefers warm temperatures but can tolerate cooler climates.
Propagation: Can be propagated from seeds or cuttings.
Fertilizer: Fertilize sparingly with a balanced fertilizer during the growing season.",https://youtu.be/PVxx6TugpCg,Sutherlandia
Africa,African Potato,Hypoxis hemerocallidea,"Yellow star, African wild potato",Grasslands and savannas of southern Africa.,"Immune booster: African potato is known for its immune-enhancing properties and is often used to help fight off infections.
Anti-inflammatory: It is used to reduce inflammation, making it beneficial for arthritis and other inflammatory conditions.
Prostate health: Traditionally used to support prostate health and relieve symptoms of prostate enlargement.
Antioxidant: Contains compounds that help neutralize harmful free radicals in the body.
Wound healing: African potato is applied to wounds to speed up the healing process and prevent infections.","African potato tea: Boil 1 tablespoon of African potato powder in 1 cup of water for 10 minutes. Strain and drink daily to boost immunity and reduce inflammation.
Wound salve: Mix 1 tablespoon of powdered African potato root with shea butter. Apply the salve to cuts and wounds to promote healing.","Soil: Prefers sandy, well-draining soil.
Light: Requires full sun to partial shade.
Water: Water moderately, allowing the soil to dry out between watering.
Temperature: Thrives in warm climates but can tolerate mild frost.
Propagation: Can be propagated from seeds or tubers.
Fertilizer: Use a balanced fertilizer during the growing season to promote healthy growth.",https://youtu.be/NyK3lTAzddw,African Potato
Africa,Hoodia,Hoodia gordonii,Bushman's hat,"Deserts of southern Africa, particularly the Kalahari Desert.","Appetite suppressant: Hoodia is widely known for its ability to suppress appetite, traditionally used by the San people during long hunting trips.
Weight loss: It is often marketed as a weight loss supplement for reducing food intake.
Energy booster: Hoodia helps provide a burst of energy, making it useful during periods of physical exertion.","Hoodia tea: Cut small pieces of Hoodia stem and steep in hot water for 10 minutes. Drink this tea to reduce hunger pangs and boost energy.
Hoodia powder capsules: Grind dried Hoodia stem into a fine powder and fill empty capsules. Take 1-2 capsules before meals to help control appetite.","Soil: Requires sandy, well-draining soil, similar to desert environments.
Light: Prefers full sunlight and can tolerate high temperatures.
Water: Water sparingly, as it is a drought-tolerant succulent.
Temperature: Thrives in hot, dry conditions but must be protected from frost.
Propagation: Grows from seeds or cuttings, but germination can take several months.
Fertilizer: Does not require frequent fertilization, but a light cactus fertilizer can be used during the growing season.",https://youtu.be/Ouqx1LwFqVo,Hoodia
